{
  "schema_version": "1.0",
  "generated_at": "2026-02-27T19:18:44Z",
  "workflows": [
    {
      "name": "AI Documentation Sync",
      "path": "/Users/ritesh/Downloads/submission_folder/fork/Terraform-Driven-Ray-on-Kubernetes-Platform/.github/workflows/ai-doc-sync.yml",
      "triggers": [
        "pull_request",
        "branches: [main]",
        "paths"
      ],
      "jobs": [
        "pull_request",
        "check"
      ],
      "depends_on_scripts": [],
      "permissions": {
        "pull-requests": "write",
        "contents": "read"
      }
    },
    {
      "name": "AI Duplicate Issue Detector",
      "path": "/Users/ritesh/Downloads/submission_folder/fork/Terraform-Driven-Ray-on-Kubernetes-Platform/.github/workflows/ai-duplicate-detector.yml",
      "triggers": [
        "issues",
        "types: [opened]"
      ],
      "jobs": [
        "issues",
        "detect"
      ],
      "depends_on_scripts": [
        "scripts/ai_duplicate_detector.py"
      ],
      "permissions": {
        "issues": "write",
        "contents": "read"
      }
    },
    {
      "name": "Gemini AI Issue Solver",
      "path": "/Users/ritesh/Downloads/submission_folder/fork/Terraform-Driven-Ray-on-Kubernetes-Platform/.github/workflows/ai-issue-solver.yml",
      "triggers": [
        "issues",
        "types: [opened]",
        "issue_comment",
        "types: [created]"
      ],
      "jobs": [
        "issues",
        "issue_comment",
        "solve"
      ],
      "depends_on_scripts": [
        "scripts/ai_issue_solver.py"
      ],
      "permissions": {
        "issues": "write",
        "contents": "read"
      }
    },
    {
      "name": "AI Test Engineer",
      "path": "/Users/ritesh/Downloads/submission_folder/fork/Terraform-Driven-Ray-on-Kubernetes-Platform/.github/workflows/ai-test-engineer.yml",
      "triggers": [
        "pull_request",
        "types: [opened, synchronize, labeled]",
        "issue_comment",
        "types: [created]"
      ],
      "jobs": [
        "pull_request",
        "issue_comment",
        "suggest-tests"
      ],
      "depends_on_scripts": [
        "scripts/ai_test_engineer.py"
      ],
      "permissions": {
        "contents": "read",
        "pull-requests": "write"
      }
    },
    {
      "name": "Agent Alpha — Governance Cycle",
      "path": "/Users/ritesh/Downloads/submission_folder/fork/Terraform-Driven-Ray-on-Kubernetes-Platform/.github/workflows/alpha-governor.yml",
      "triggers": [
        "repository_dispatch",
        "types: [governance-cycle]",
        "workflow_dispatch"
      ],
      "jobs": [
        "repository_dispatch",
        "workflow_dispatch",
        "govern"
      ],
      "depends_on_scripts": [
        "scripts/alpha_governor.py"
      ],
      "permissions": {
        "contents": "write",
        "issues": "write"
      }
    },
    {
      "name": "Assignment Follow-up",
      "path": "/Users/ritesh/Downloads/submission_folder/fork/Terraform-Driven-Ray-on-Kubernetes-Platform/.github/workflows/assignment-followup.yml",
      "triggers": [
        "schedule",
        "workflow_dispatch"
      ],
      "jobs": [
        "schedule",
        "workflow_dispatch",
        "followup"
      ],
      "depends_on_scripts": [],
      "permissions": {
        "issues": "write",
        "contents": "read"
      }
    },
    {
      "name": "AWS Resource Cleanup Scanner",
      "path": "/Users/ritesh/Downloads/submission_folder/fork/Terraform-Driven-Ray-on-Kubernetes-Platform/.github/workflows/aws-cleanup.yml",
      "triggers": [
        "schedule",
        "workflow_dispatch:  # Allow manual trigger"
      ],
      "jobs": [
        "schedule",
        "scan"
      ],
      "depends_on_scripts": [],
      "permissions": {
        "issues": "write"
      }
    },
    {
      "name": "Agent Beta — PR Code Review",
      "path": "/Users/ritesh/Downloads/submission_folder/fork/Terraform-Driven-Ray-on-Kubernetes-Platform/.github/workflows/beta-reviewer.yml",
      "triggers": [
        "pull_request",
        "types: [labeled]"
      ],
      "jobs": [
        "pull_request",
        "review"
      ],
      "depends_on_scripts": [
        "scripts/beta_reviewer.py"
      ],
      "permissions": {
        "contents": "write",
        "pull-requests": "write",
        "issues": "write"
      }
    },
    {
      "name": "Bot Commands",
      "path": "/Users/ritesh/Downloads/submission_folder/fork/Terraform-Driven-Ray-on-Kubernetes-Platform/.github/workflows/bot-commands.yml",
      "triggers": [
        "issue_comment",
        "types: [created]"
      ],
      "jobs": [
        "issue_comment",
        "handle-command"
      ],
      "depends_on_scripts": [],
      "permissions": {
        "contents": "read",
        "issues": "write",
        "pull-requests": "write"
      }
    },
    {
      "name": "Chaos Engineering / Resilience Validation",
      "path": "/Users/ritesh/Downloads/submission_folder/fork/Terraform-Driven-Ray-on-Kubernetes-Platform/.github/workflows/chaos-engineering.yml",
      "triggers": [
        "workflow_dispatch",
        "inputs",
        "target_environment",
        "description: 'Environment to run chaos against'",
        "required: true",
        "default: 'staging'",
        "schedule"
      ],
      "jobs": [
        "workflow_dispatch",
        "schedule",
        "chaos-test"
      ],
      "depends_on_scripts": [],
      "permissions": {
        "id-token": "write",
        "contents": "read"
      }
    },
    {
      "name": "Checkov — Security Scan",
      "path": "/Users/ritesh/Downloads/submission_folder/fork/Terraform-Driven-Ray-on-Kubernetes-Platform/.github/workflows/checkov.yml",
      "triggers": [
        "push",
        "branches: [main]",
        "pull_request",
        "branches: [main]",
        "paths"
      ],
      "jobs": [
        "push",
        "pull_request",
        "checkov"
      ],
      "depends_on_scripts": [],
      "permissions": {
        "contents": "read",
        "security-events": "write  # upload SARIF",
        "steps": "",
        "- uses": "actions/checkout@v4",
        "- name": "Upload SARIF to GitHub Security",
        "uses": "github/codeql-action/upload-sarif@v4",
        "with": "",
        "directory": "terraform",
        "framework": "terraform,helm",
        "output_format": "sarif",
        "output_file_path": "reports/checkov.sarif",
        "soft_fail": "true",
        "skip_check": "CKV_AWS_149,CKV_AWS_111,CKV_AWS_355",
        "if": "always()",
        "sarif_file": "reports/checkov.sarif",
        "category": "checkov"
      }
    },
    {
      "name": "Code Coverage",
      "path": "/Users/ritesh/Downloads/submission_folder/fork/Terraform-Driven-Ray-on-Kubernetes-Platform/.github/workflows/codecov.yml",
      "triggers": [
        "push",
        "branches: [main]",
        "paths: ['workloads/**/*.py', 'scripts/**/*.py']",
        "pull_request",
        "branches: [main]"
      ],
      "jobs": [
        "push",
        "pull_request",
        "coverage"
      ],
      "depends_on_scripts": [],
      "permissions": {}
    },
    {
      "name": "CodeQL — Security Analysis",
      "path": "/Users/ritesh/Downloads/submission_folder/fork/Terraform-Driven-Ray-on-Kubernetes-Platform/.github/workflows/codeql.yml",
      "triggers": [
        "push",
        "branches: [main]",
        "pull_request",
        "branches: [main]",
        "schedule"
      ],
      "jobs": [
        "push",
        "pull_request",
        "schedule",
        "analyze"
      ],
      "depends_on_scripts": [],
      "permissions": {
        "actions": "read",
        "contents": "read",
        "security-events": "write",
        "strategy": "",
        "fail-fast": "false",
        "matrix": "",
        "language": "[python]",
        "steps": "",
        "- uses": "actions/checkout@v4",
        "- name": "Perform CodeQL Analysis",
        "uses": "github/codeql-action/analyze@v4",
        "with": "",
        "languages": "${{ matrix.language }}",
        "queries": "security-and-quality",
        "category": "\"/language:${{ matrix.language }}\""
      }
    },
    {
      "name": "Contributor Greeting",
      "path": "/Users/ritesh/Downloads/submission_folder/fork/Terraform-Driven-Ray-on-Kubernetes-Platform/.github/workflows/contributor-greeting.yml",
      "triggers": [
        "issues",
        "types: [opened]",
        "pull_request_target",
        "types: [opened]"
      ],
      "jobs": [
        "issues",
        "pull_request_target",
        "greet"
      ],
      "depends_on_scripts": [],
      "permissions": {
        "issues": "write",
        "pull-requests": "write"
      }
    },
    {
      "name": "Agent Delta — Issue Executor",
      "path": "/Users/ritesh/Downloads/submission_folder/fork/Terraform-Driven-Ray-on-Kubernetes-Platform/.github/workflows/delta-executor.yml",
      "triggers": [
        "issues",
        "types: [labeled]"
      ],
      "jobs": [
        "issues",
        "execute"
      ],
      "depends_on_scripts": [
        "scripts/delta_executor.py"
      ],
      "permissions": {
        "contents": "write",
        "pull-requests": "write",
        "issues": "write"
      }
    },
    {
      "name": "Dependency Security Audit",
      "path": "/Users/ritesh/Downloads/submission_folder/fork/Terraform-Driven-Ray-on-Kubernetes-Platform/.github/workflows/dependency-check.yml",
      "triggers": [
        "schedule",
        "push",
        "branches: [main]",
        "paths: ['requirements.txt', 'workloads/**/*.py']",
        "pull_request",
        "branches: [main]",
        "paths: ['requirements.txt']"
      ],
      "jobs": [
        "schedule",
        "push",
        "pull_request",
        "audit"
      ],
      "depends_on_scripts": [],
      "permissions": {}
    },
    {
      "name": "Diagram Drift Detector",